{
  "schemaVersion": "CommerceFulfillmentReady/v1",
  "eventType": "commerce.fulfillment_ready",
  "eventId": "cfr_01K36D8K6G5YQ9H2J4M7N8P0RS",
  "occurredAt": "2026-08-23T09:30:00Z",
  "platform": "ahiabekee",
  "store": {
    "id": "ng-main",
    "code": "NG-MAIN",
    "name": "Ahiabekee Nigeria",
    "countryCode": "NG",
    "currency": "NGN"
  },
  "order": {
    "id": "1001",
    "number": "AHB-20260823-1001",
    "createdAt": "2026-08-23T08:15:00Z"
  },
  "fulfillment": {
    "id": "1001-1",
    "number": "F-1",
    "version": 1,
    "readyAt": "2026-08-23T09:30:00Z"
  },
  "merchant": {
    "logisticsCustomerId": "cus_01ARZ3NDEKTSV4RRFFQ69G5FAV"
  },
  "referenceNumber": "ahiabekee:NG-MAIN:AHB-20260823-1001:F-1",
  "serviceCode": "EXPRESS",
  "sender": {
    "contactName": "Ada Okafor",
    "companyName": "Ahiabekee Lagos Fulfilment Centre",
    "phone": "+2348012345601",
    "email": "dispatch@example.test",
    "line1": "12 Warehouse Avenue",
    "landmark": "Near the cargo terminal",
    "city": "Ikeja",
    "state": "Lagos",
    "pincode": "100001",
    "countryCode": "NG"
  },
  "recipient": {
    "externalCustomerId": "customer-1001",
    "contactName": "Chinedu Eze",
    "phone": "+2348012345602",
    "email": "recipient@example.test",
    "line1": "25 Example Crescent",
    "line2": "Wuse II",
    "city": "Abuja",
    "state": "Federal Capital Territory",
    "pincode": "900001",
    "countryCode": "NG"
  },
  "packages": [
    {
      "reference": "AHB-1001-P1",
      "actualWeightGrams": 1800,
      "lengthMm": 400,
      "widthMm": 300,
      "heightMm": 250,
      "contentDescription": "Home appliances",
      "declaredValueMinor": 11500000
    },
    {
      "reference": "AHB-1001-P2",
      "actualWeightGrams": 700,
      "lengthMm": 300,
      "widthMm": 250,
      "heightMm": 150,
      "contentDescription": "Books and accessories",
      "declaredValueMinor": 3500000
    }
  ],
  "payment": {
    "mode": "COD",
    "currency": "NGN",
    "merchandiseSubtotalMinor": 15500000,
    "discountMinor": 500000,
    "taxMinor": 1125000,
    "shippingChargeMinor": 500000,
    "prepaidAmountMinor": 0,
    "storeCreditAppliedMinor": 0,
    "orderTotalMinor": 16625000,
    "codAmountMinor": 16625000
  },
  "declaredValueMinor": 15000000,
  "insuranceRequired": true,
  "contentDescription": "Home appliances, books and accessories",
  "specialInstructions": "Call the recipient before arrival.",
  "isFragile": true,
  "isDangerousGoods": false,
  "metadata": {
    "sourceChannel": "web",
    "salesChannel": "direct"
  }
}
